강수	precipitation 降水
포근하다	to be mild (weather)
개나리	forsythia (yellow flower - blooms in spring)
진달래	azalea (pink flower - blooms in spring)
삼가다	to refrain from (doing something) (어떤 것을 피하거나 양이나 횟수를 적게 하다.) / to be careful (말이나 행동을 조심해서 하다)
착용하다	to wear, put on 着用
집중 호우	localised heavy rainfall 集中豪雨
열대야	tropical night 熱帶夜
난로	heater 煖爐
지형	topography (land shape) 地形
산지	mountainous region 山地
평야	plain (flat region) 平野
동고서저	east high west low (Korea's topography) 東高西低
등줄기	(back) spine
산맥	mountain range 山脈 (not ...줄기)
해안	coast 海岸 (not 연...)
수심	water depth 水深
얕다	to be shallow (depth)
단조롭다	to be unchanging, monotonous (characterised by) 單調
갯벌	mud flats
터전	a lot, site (집터가 되는 땅) / a base, foundation (일의 토대)
멸종	extinction 滅種
물새	water birds
서식지	habitat 棲息地
생태계	ecosystem 生態系
연안	shore (바다, 강, 호수 등과 닿아 있는 땅) coast (땅과 닿아 있는 바다, 강, 호수 등의 물가) 沿岸 (not 해...)
산줄기	mountain range 山XX (not ...맥)
산행	hiking, mountain climbing 山行
고온다습	high heat & humidity - Korean summer 高溫多濕
천고마비	high sky and fat horses (sky high horse fat) (plenty) - Korean Autumn天高馬肥
한랭건조	cold and dry weather - Korean winter 寒冷乾燥
간척사업	reclamation project (reclaiming land from the sea) 干拓事業
좌우로	from left to right 左右로
이 분의 일	1/2 (one half) 
면적	area (e.g. of a country) 面積
분포하다	[동사] to be distributed, be spread (일정한 범위에 흩어져 퍼져 있다) 分布 (not 퍼지다)
도매	wholesale 都賣
복합쇼핑몰	a shopping mall complex 複合XXX
연계	connection, link 連繫
오가다	to come and go
화교	Chinese person living abroad 華僑
치장하다	to decorate (someone or something) (잘 매만져 곱게 꾸미다) 治粧
한중	(between) Korea and China 韓中
삼국지연의	Romance of the Three Kingdoms (famous Chinese historical novel) 三國志演義
담장	a stone/brick wall X牆 (not 벽)
경관	landscape, scenery (산, 들, 강, 바다 등의 자연이나 주변의 전체적인 모습) 景觀 (not ...치)
해돋이	sunrise 
항공편	a flight (airplane) 航空便
광물	mineral (resource) 鑛物
석탄	coal 石炭
채굴하다	to mine 採掘
폐광	disused mine 廢鑛
눈길을 끌다	to draw one's eye line, attention
광부	a miner 鑛夫
눈꽃	snow on the branches of trees (lit: snow flower)
거듭나다	to be reborn, reformed, to start over (verb) (지금까지의 방식이나 태도를 버리고 새롭게 시작하다)
철쭉	royal azalea
일조	sunshine 日照
국토	territory (not 영...) 國土
이전하다	to relocate (something), move 移轉
위상	status (어떤 사물이 다른 사물과의 관계 속에서 가지는 위치나 상태) 位相
목장	(more open, wider) farm for cows, horses etc 牧場
제철소	steelworks (like in 포항) 製鐵所
행사를 치르다	to host an event 行事를...
육상	athletics 陸上
명실상부하다	to be true to (one's) name, live up to reputation 名實相符
전용이다	to be exclusive (exclusive use) 專用이다
기름지다	to be fertile (land) (not 비옥)
비옥하다	to be fertile (land) 肥沃 (not 기름...)
어업	fishing industry 漁業
양식하다	to farm fish or seafood 養殖
개통되다	to be opened - used about transport links PASSIVE 開通
접근성	accessibility (personality) 接近性 
우뚝우뚝	[의태어] high up, towering 
솟다	to soar, rise up
오름	a volcanic cone (found on 제주도)
용암	lava 鎔巖
성산일출봉	volcanic tuff-cone in 제주도 城山日出峰
돌하루방	rock statues found on 제주도
삼다도	another name for Jeju - because 바람, 돌, 여자 많다 三多島
현무암	basalt (rock) 玄武巖
영남	another name for 경상남북도 嶺南
호남	another name for 전라남북도 湖南
박람회	exhibition (trade fair) 博覽會
철새	migratory bird
생태적	ecological 生態的
모래사장	sandy beach --沙場
석회암	limestone 石灰岩
종유석	stalactite (hanging down) 鍾乳石
석순	stalactite (coming up) 石筍
뽐내다	to boast, flaunt, show off
함축적	connotative, implicative (말이나 글이 속에 어떤 뜻을 담고 있는) 含蓄的
늪	a marsh, swamp
자연사박물관	natural history museum 自然史博物館
유유자적하다	to live freely and easily 悠悠自適
미학	aesthetics 美學
물길	water way / water course
쉼터	a rest area
특산물	regional specialty (product) 特産物 
발자취	footprints / traces (of history) (not 흔적)
무형문화 	intangible (no shape) culture e.g. 탈춤 無形文化
유형 문화재	tangible cultural asset (e.g. 도자기) 有形文化財
개장하다	to open (for business) 開場
연계되다	to be connected with, have links with, have a relationship with PASSIVE  連繫 (not ...결, 관...)
일대	the whole area, district 一帶
대첩	a great (military) victory 大捷
군항	a naval port 軍港
꼬막	cockles / clams (seafood)
만	bay (coastal area) 灣
갈대	reed (plant)
해넘이	sunset
주간	(a period of) a week 週間
회관	meeting hall 會館
살림살이	housekeeping (domestic budget, day-to-day living etc)
신호등	traffic lights 信號燈
양육수당	Child Benefit (support allowance) 養育手當
민간시설	private facilities 民間施設
답사	field investigation (common for school trips) 踏査 
생생하다	to be vivid 生生
홍보과	a public relations (PR) department 弘報課
철저하다	to be thorough 徹底
욕구 	desire for, appetite for 欲求
필연적	inevitable, inescapable (사물의 관련이나 일의 결과가 반드시 그렇게 될 수밖에 없는. 또는 그런 것) 必然的
어촌	fishing village 漁村
촌락	village 村落 (not 마을)
이기심	selfishness 利己心
혐오시설 	unwanted facilities (e.g. 소각장, 하수도 처리 시설) 嫌惡施設
선호시설	desired facilities (e.g. 학교, 지하철역, 공공기관) 選好施設
따지다	to care, be concerned about (not 신경을 쓰다)
폐기물	waste (materials) 廢棄物
고민거리	a source of trouble/worry 苦悶XX
논의하다	to discuss, debate, argue 論議 (not 토..)
험난하다	to be rough, difficult (situation) / to be rough (terrain) 險難
견학하다	to take a field trip to / to visit, tour 見學
총회	general meeting 總會
공감	sympathy 共感
손잡다	to join hands / to cooperate 
결의하다	to decide, resolve (뜻을 정하여 굳게 마음을 먹다) 決意
배부하다	to distribute, hand-out 配付
대청소	a big clean-up 大淸掃
창단하다	to establish, found, create (a group) 創團
